{
  "schema_version": 1,
  "profile_id": "cn.2026.09.01.0000.0000.local",
  "region": "CN",
  "game_build": "2026.09.01.0000.0000",
  "generated_at": "2026-09-09T12:30:00.000Z",
  "mentor_roulette_id": 9,
  "compatibility_status": "VERIFIED",
  "match_window_seconds": 3600,
  "messages": [
    {
      "name": "CONTENT_FINDER_POP",
      "opcode": 49153,
      "direction": "CLIENT_TO_SERVER",
      "expected_length": 24,
      "fields": [
        {
          "name": "roulette_id",
          "offset": 0,
          "type": "u8",
          "endian": "little",
          "constraints": {
            "min": 1,
            "max": 255
          }
        }
      ]
    },
    {
      "name": "MATCH_ANNOUNCED",
      "opcode": 61453,
      "direction": "SERVER_TO_CLIENT",
      "expected_length": 12,
      "fields": []
    },
    {
      "name": "ZONE_INITIALIZATION",
      "opcode": 41223,
      "direction": "SERVER_TO_CLIENT",
      "expected_length": 456,
      "fields": []
    },
    {
      "name": "ZONE_TERRITORY",
      "opcode": 41224,
      "direction": "SERVER_TO_CLIENT",
      "expected_length": 136,
      "fields": [
        {
          "name": "territory_id",
          "offset": 2,
          "type": "u16",
          "endian": "little",
          "constraints": {
            "min": 1
          }
        }
      ]
    },
    {
      "name": "PLAYER_JOB",
      "opcode": 41225,
      "direction": "SERVER_TO_CLIENT",
      "expected_length": 16,
      "fields": [
        {
          "name": "job_id",
          "offset": 0,
          "type": "u8",
          "endian": "little",
          "constraints": {
            "min": 1,
            "max": 43
          }
        }
      ]
    }
  ],
  "fixtures": [],
  "provenance": {
    "summary": "本机校准生成的档案。报文结构（长度、字段偏移、数据字段约束、指导者轮盘编号 9、匹配窗口 3600 秒）继承自随包档案 cn.template；opcode 由本机在客户端 2026.09.01.0000.0000 的被动流量中按结构与时序重新识别（排本请求 C2S 0xc001 与其回执配对），涉及轮盘编号 1、2；这一版没能认出服务器发出的「匹配成功」报文，因此本档案改用玩家自己发出的排本请求作为起点，再由随后进入的已知副本确认；这是推断而不是观察，档案里的 CONTENT_FINDER_POP 方向为 CLIENT_TO_SERVER 即为标记。另外本机按出现时机认出了一条只在排本期间、且每次进本之前都会出现的服务器报文，记为 MATCH_ANNOUNCED：它只提供「匹配成功」的时刻，所排的轮盘仍然由排本请求确定，详见各条证据。用户核对时间线后启用。本档案不含 calibration 段，不能作为下一版本的模板；同版本的随包档案出现时自动让位。",
    "evidence": [
      {
        "field": "messages.CONTENT_FINDER_POP.opcode",
        "method": "OBSERVED_LOCAL_TRAFFIC",
        "recorded_at_utc": "2026-09-09T12:30:00.000Z",
        "sample_count": 4,
        "note": "本机校准：在客户端 2026.09.01.0000.0000 的被动流量里，按模板 cn.template 的 CONTENT_FINDER_POP 结构（长度 24、字段偏移继承自模板）找到唯一满足条件的 opcode，样本 4 次。判据：这一版没有认出服务器发出的「匹配成功」报文。本条记录的是客户端发出的排本请求本身（长度与轮盘编号偏移来自模板的 calibration 段，opcode 由请求/回执配对确定）；「这次排本确实匹配上了」由随后一小时内进入的、副本表能认出的副本来确认，期间若有其他副本进入则不采信。玩家申请后取消、随后自行进入副本时可能误记一次，这是本路径已知且唯一的代价。"
      },
      {
        "field": "messages.MATCH_ANNOUNCED.opcode",
        "method": "OBSERVED_LOCAL_TRAFFIC",
        "recorded_at_utc": "2026-09-09T12:30:00.000Z",
        "sample_count": 2,
        "note": "本机校准：在客户端 2026.09.01.0000.0000 的被动流量里，按出现时机认出这条服务器报文（方向 SERVER_TO_CLIENT、长度 12，不声明任何字段）；有 2 次进本由它先行。判据：这一版的匹配通知在任何字节位置都不带轮盘编号，按数值找不到，因此只按出现时机认定。候选须满足：首次出现时本连接有未结束的排本申请；此后无人排本时的出现须在模板匹配窗口内由已知副本的加载解释，解释不了的出现不超过总次数的五分之一、总次数不超过 400，且保留的出现中至少一半其后在模板匹配窗口内有已知副本加载；不属于任何换区簇；在每一次「自己申请后进入已知副本」之前的模板匹配窗口内都至少出现一次，且晚于对应申请；这样的进本至少两次、涉及至少两个不同轮盘；每次排本窗口内出现不超过 8 次。若仍有多个候选，取各次进本最小提前量最大的那个；并列则不启用。本条只提供匹配时刻，不提供轮盘编号。"
      },
      {
        "field": "messages.ZONE_INITIALIZATION.opcode",
        "method": "OBSERVED_LOCAL_TRAFFIC",
        "recorded_at_utc": "2026-09-09T12:30:00.000Z",
        "sample_count": 5,
        "note": "本机校准：在客户端 2026.09.01.0000.0000 的被动流量里，按模板 cn.template 的 ZONE_INITIALIZATION 结构（长度 456、字段偏移继承自模板）找到唯一满足条件的 opcode，样本 5 次。判据：长度等于模板长度，在至少三个换区簇里各恰好出现一次，且所选同一链的进本、出本簇各恰好一次；簇外出现不超过 2 次，或簇外次数的 3 倍不超过它恰好出现一次的簇数。"
      },
      {
        "field": "messages.ZONE_TERRITORY.opcode",
        "method": "OBSERVED_LOCAL_TRAFFIC",
        "recorded_at_utc": "2026-09-09T12:30:00.000Z",
        "sample_count": 2,
        "note": "本机校准：在客户端 2026.09.01.0000.0000 的被动流量里，按模板 cn.template 的 ZONE_TERRITORY 结构（长度 136、字段偏移继承自模板）找到唯一满足条件的 opcode，样本 2 次。判据：进本簇里恰好出现一次，且区域编号命中副本表。"
      },
      {
        "field": "messages.PLAYER_JOB.opcode",
        "method": "OBSERVED_LOCAL_TRAFFIC",
        "recorded_at_utc": "2026-09-09T12:30:00.000Z",
        "sample_count": 5,
        "note": "本机校准：在客户端 2026.09.01.0000.0000 的被动流量里，按模板 cn.template 的 PLAYER_JOB 结构（长度 16、字段偏移继承自模板）找到唯一满足条件的 opcode，样本 5 次。判据：进本、出本两个换区簇都出现且取值稳定、满足职业编号约束，全部换区簇（含进本、出本）至少半数出现，没有任何换区簇与之矛盾。"
      },
      {
        "field": "messages.MATCH_ANNOUNCED.opcode",
        "method": "USER_CONFIRMED",
        "recorded_at_utc": "2026-09-09T12:30:00.000Z",
        "sample_count": 2,
        "note": "用户逐条确认了时间线上「匹配弹窗（按出现时机认出）」各行与自己看到的弹窗时刻一致。"
      },
      {
        "field": "messages.CONTENT_FINDER_POP.opcode",
        "method": "USER_CONFIRMED",
        "recorded_at_utc": "2026-09-09T12:30:00.000Z",
        "sample_count": 6,
        "note": "用户接受了「按排本申请推断匹配」的记录方式：本档案不声称观察到了服务器的匹配报文。"
      },
      {
        "field": "messages.CONTENT_FINDER_POP.opcode",
        "method": "USER_CONFIRMED",
        "recorded_at_utc": "2026-09-09T12:30:00.000Z",
        "sample_count": 6,
        "note": "用户在软件里逐条核对了校准时间线（排本、匹配弹窗、进入副本、离开副本）并全部确认无误。"
      },
      {
        "field": "messages.ZONE_INITIALIZATION.opcode",
        "method": "USER_CONFIRMED",
        "recorded_at_utc": "2026-09-09T12:30:00.000Z",
        "sample_count": 6,
        "note": "用户在软件里逐条核对了校准时间线（排本、匹配弹窗、进入副本、离开副本）并全部确认无误。"
      }
    ]
  },
  "profile_sha256": "2dabe97b5bbde0bd7e8b062f5c5f49c834c87a7d3e15fade4e1317f89ac1ee0e"
}