{
  "schema_version": 1,
  "profile_id": "cn.2026.09.01.0000.0000.local",
  "region": "CN",
  "game_build": "2026.09.01.0000.0000",
  "generated_at": "2026-09-09T12:30:00.000Z",
  "mentor_roulette_id": 9,
  "compatibility_status": "VERIFIED",
  "match_window_seconds": 3600,
  "messages": [
    {
      "name": "CONTENT_FINDER_POP",
      "opcode": 49153,
      "direction": "CLIENT_TO_SERVER",
      "expected_length": 24,
      "fields": [
        {
          "name": "roulette_id",
          "offset": 0,
          "type": "u8",
          "endian": "little",
          "constraints": {
            "min": 1,
            "max": 255
          }
        }
      ]
    },
    {
      "name": "ZONE_INITIALIZATION",
      "opcode": 41223,
      "direction": "SERVER_TO_CLIENT",
      "expected_length": 456,
      "fields": []
    },
    {
      "name": "ZONE_TERRITORY",
      "opcode": 41224,
      "direction": "SERVER_TO_CLIENT",
      "expected_length": 136,
      "fields": [
        {
          "name": "territory_id",
          "offset": 2,
          "type": "u16",
          "endian": "little",
          "constraints": {
            "min": 1
          }
        }
      ]
    }
  ],
  "fixtures": [],
  "provenance": {
    "summary": "本机校准生成的档案。报文结构（长度、字段偏移、数据字段约束、指导者轮盘编号 9、匹配窗口 3600 秒）继承自随包档案 cn.template；opcode 由本机在客户端 2026.09.01.0000.0000 的被动流量中按结构与时序重新识别（排本请求 C2S 0xc001 与其回执配对），涉及轮盘编号 1、2；这一版没能认出服务器发出的「匹配成功」报文，因此本档案改用玩家自己发出的排本请求作为起点，再由随后进入的已知副本确认；这是推断而不是观察，档案里的 CONTENT_FINDER_POP 方向为 CLIENT_TO_SERVER 即为标记，详见各条证据。用户核对时间线后启用。本档案不含 calibration 段，不能作为下一版本的模板；同版本的随包档案出现时自动让位。",
    "evidence": [
      {
        "field": "messages.CONTENT_FINDER_POP.opcode",
        "method": "OBSERVED_LOCAL_TRAFFIC",
        "recorded_at_utc": "2026-09-09T12:30:00.000Z",
        "sample_count": 3,
        "note": "本机校准：在客户端 2026.09.01.0000.0000 的被动流量里，按模板 cn.template 的 CONTENT_FINDER_POP 结构（长度 24、字段偏移继承自模板）找到唯一满足条件的 opcode，样本 3 次。判据：这一版没有认出服务器发出的「匹配成功」报文。本条记录的是客户端发出的排本请求本身（长度与轮盘编号偏移来自模板的 calibration 段，opcode 由请求/回执配对确定）；「这次排本确实匹配上了」由随后一小时内进入的、副本表能认出的副本来确认，期间若有其他副本进入则不采信。玩家申请后取消、随后自行进入副本时可能误记一次，这是本路径已知且唯一的代价。"
      },
      {
        "field": "messages.ZONE_INITIALIZATION.opcode",
        "method": "OBSERVED_LOCAL_TRAFFIC",
        "recorded_at_utc": "2026-09-09T12:30:00.000Z",
        "sample_count": 3,
        "note": "本机校准：在客户端 2026.09.01.0000.0000 的被动流量里，按模板 cn.template 的 ZONE_INITIALIZATION 结构（长度 456、字段偏移继承自模板）找到唯一满足条件的 opcode，样本 3 次。判据：长度等于模板长度，在至少三个换区簇里各恰好出现一次，且所选同一链的进本、出本簇各恰好一次；簇外出现不超过 2 次，或簇外次数的 3 倍不超过它恰好出现一次的簇数。"
      },
      {
        "field": "messages.ZONE_TERRITORY.opcode",
        "method": "OBSERVED_LOCAL_TRAFFIC",
        "recorded_at_utc": "2026-09-09T12:30:00.000Z",
        "sample_count": 1,
        "note": "本机校准：在客户端 2026.09.01.0000.0000 的被动流量里，按模板 cn.template 的 ZONE_TERRITORY 结构（长度 136、字段偏移继承自模板）找到唯一满足条件的 opcode，样本 1 次。判据：进本簇里恰好出现一次，且区域编号命中副本表。"
      },
      {
        "field": "messages.CONTENT_FINDER_POP.opcode",
        "method": "USER_CONFIRMED",
        "recorded_at_utc": "2026-09-09T12:30:00.000Z",
        "sample_count": 4,
        "note": "用户接受了「按排本申请推断匹配」的记录方式：本档案不声称观察到了服务器的匹配报文。"
      },
      {
        "field": "messages.CONTENT_FINDER_POP.opcode",
        "method": "USER_CONFIRMED",
        "recorded_at_utc": "2026-09-09T12:30:00.000Z",
        "sample_count": 4,
        "note": "用户在软件里逐条核对了校准时间线（排本、匹配弹窗、进入副本、离开副本）并全部确认无误。"
      },
      {
        "field": "messages.ZONE_INITIALIZATION.opcode",
        "method": "USER_CONFIRMED",
        "recorded_at_utc": "2026-09-09T12:30:00.000Z",
        "sample_count": 4,
        "note": "用户在软件里逐条核对了校准时间线（排本、匹配弹窗、进入副本、离开副本）并全部确认无误。"
      }
    ]
  },
  "profile_sha256": "264ef9ce1ebe3ee0fe5dab545371770004472bf9160b9e2ee8b9bd0e5a5d4c9f"
}