{
  "schema_version": 1,
  "profile_id": "cn.2026.09.01.0000.0000.local",
  "region": "CN",
  "game_build": "2026.09.01.0000.0000",
  "generated_at": "2026-09-09T12:30:00.000Z",
  "mentor_roulette_id": 9,
  "compatibility_status": "VERIFIED",
  "match_window_seconds": 120,
  "messages": [
    {
      "name": "CONTENT_FINDER_POP",
      "opcode": 61453,
      "direction": "SERVER_TO_CLIENT",
      "expected_length": 64,
      "fields": [
        {
          "name": "roulette_id",
          "offset": 16,
          "type": "u8",
          "endian": "little",
          "constraints": {
            "min": 1,
            "max": 255
          }
        }
      ]
    },
    {
      "name": "ZONE_INITIALIZATION",
      "opcode": 41223,
      "direction": "SERVER_TO_CLIENT",
      "expected_length": 456,
      "fields": []
    },
    {
      "name": "ZONE_TERRITORY",
      "opcode": 41224,
      "direction": "SERVER_TO_CLIENT",
      "expected_length": 136,
      "fields": [
        {
          "name": "territory_id",
          "offset": 2,
          "type": "u16",
          "endian": "little",
          "constraints": {
            "min": 1
          }
        }
      ]
    },
    {
      "name": "PLAYER_JOB",
      "opcode": 41225,
      "direction": "SERVER_TO_CLIENT",
      "expected_length": 16,
      "fields": [
        {
          "name": "job_id",
          "offset": 0,
          "type": "u8",
          "endian": "little",
          "constraints": {
            "min": 1,
            "max": 43
          }
        }
      ]
    }
  ],
  "fixtures": [],
  "provenance": {
    "summary": "本机校准生成的档案。报文结构（长度、字段偏移、数据字段约束、指导者轮盘编号 9、匹配窗口 120 秒）继承自随包档案 cn.template；opcode 由本机在客户端 2026.09.01.0000.0000 的被动流量中按结构与时序重新识别（排本请求 C2S 0xc001 与其回执配对），涉及轮盘编号 1、2；「匹配成功」在这一版是与排本回执不同的一条报文，其 opcode 与长度均来自本机观察，详见各条证据。用户核对时间线后启用。本档案不含 calibration 段，不能作为下一版本的模板；同版本的随包档案出现时自动让位。",
    "evidence": [
      {
        "field": "messages.CONTENT_FINDER_POP.opcode",
        "method": "OBSERVED_LOCAL_TRAFFIC",
        "recorded_at_utc": "2026-09-09T12:30:00.000Z",
        "sample_count": 3,
        "note": "本机校准：在客户端 2026.09.01.0000.0000 的被动流量里，按模板 cn.template 的 CONTENT_FINDER_POP 结构（长度 64、字段偏移继承自模板）找到唯一满足条件的 opcode，样本 3 次。判据：这一版把「匹配成功」发在与排本回执不同的报文上，因此按独立报文识别。候选须在同一连接上晚于同轮盘的已配对排本请求、在回执窗口与实际加载之外到达，并且在模板匹配窗口内先于每一次已知副本进本；同时该报文种类从不出现在任何换区簇内部（属于加载的报文会随每次换区一起出现，宣布匹配的报文不会）。若仍并列，再要求它出现过而其后没有任何进本；仍然并列则不启用。"
      },
      {
        "field": "messages.ZONE_INITIALIZATION.opcode",
        "method": "OBSERVED_LOCAL_TRAFFIC",
        "recorded_at_utc": "2026-09-09T12:30:00.000Z",
        "sample_count": 3,
        "note": "本机校准：在客户端 2026.09.01.0000.0000 的被动流量里，按模板 cn.template 的 ZONE_INITIALIZATION 结构（长度 456、字段偏移继承自模板）找到唯一满足条件的 opcode，样本 3 次。判据：长度等于模板长度，在至少三个换区簇里各恰好出现一次，且所选同一链的进本、出本簇各恰好一次；簇外出现不超过 2 次，或簇外次数的 3 倍不超过它恰好出现一次的簇数。"
      },
      {
        "field": "messages.ZONE_TERRITORY.opcode",
        "method": "OBSERVED_LOCAL_TRAFFIC",
        "recorded_at_utc": "2026-09-09T12:30:00.000Z",
        "sample_count": 1,
        "note": "本机校准：在客户端 2026.09.01.0000.0000 的被动流量里，按模板 cn.template 的 ZONE_TERRITORY 结构（长度 136、字段偏移继承自模板）找到唯一满足条件的 opcode，样本 1 次。判据：进本簇里恰好出现一次，且区域编号命中副本表。"
      },
      {
        "field": "messages.PLAYER_JOB.opcode",
        "method": "OBSERVED_LOCAL_TRAFFIC",
        "recorded_at_utc": "2026-09-09T12:30:00.000Z",
        "sample_count": 3,
        "note": "本机校准：在客户端 2026.09.01.0000.0000 的被动流量里，按模板 cn.template 的 PLAYER_JOB 结构（长度 16、字段偏移继承自模板）找到唯一满足条件的 opcode，样本 3 次。判据：进本、出本两个换区簇都出现且取值稳定、满足职业编号约束，全部换区簇（含进本、出本）至少半数出现，没有任何换区簇与之矛盾。"
      },
      {
        "field": "messages.CONTENT_FINDER_POP.opcode",
        "method": "USER_CONFIRMED",
        "recorded_at_utc": "2026-09-09T12:30:00.000Z",
        "sample_count": 5,
        "note": "用户在软件里逐条核对了校准时间线（排本、匹配弹窗、进入副本、离开副本）并全部确认无误。"
      },
      {
        "field": "messages.ZONE_INITIALIZATION.opcode",
        "method": "USER_CONFIRMED",
        "recorded_at_utc": "2026-09-09T12:30:00.000Z",
        "sample_count": 5,
        "note": "用户在软件里逐条核对了校准时间线（排本、匹配弹窗、进入副本、离开副本）并全部确认无误。"
      }
    ]
  },
  "profile_sha256": "3d4d97a71e8197d0813e7571dc838cf9e5bdf757eb3f6b9e5ab7e2c70cde47c1"
}