{
  "schema_version": 1,
  "profile_id": "cn.2026.09.01.0000.0000.local",
  "region": "CN",
  "game_build": "2026.09.01.0000.0000",
  "generated_at": "2026-09-09T12:30:00.000Z",
  "mentor_roulette_id": 9,
  "compatibility_status": "VERIFIED",
  "match_window_seconds": 120,
  "messages": [
    {
      "name": "CONTENT_FINDER_POP",
      "opcode": 49154,
      "direction": "SERVER_TO_CLIENT",
      "expected_length": 40,
      "fields": [
        {
          "name": "finder_state",
          "offset": 9,
          "type": "u8",
          "endian": "little",
          "role": "selector",
          "constraints": {
            "in": [
              3
            ]
          }
        },
        {
          "name": "roulette_id",
          "offset": 16,
          "type": "u8",
          "endian": "little",
          "constraints": {
            "min": 1,
            "max": 255
          }
        }
      ]
    },
    {
      "name": "ZONE_INITIALIZATION",
      "opcode": 41223,
      "direction": "SERVER_TO_CLIENT",
      "expected_length": 456,
      "fields": []
    }
  ],
  "fixtures": [],
  "provenance": {
    "summary": "本机校准生成的档案。报文结构（长度、字段偏移、数据字段约束、指导者轮盘编号 9、匹配窗口 120 秒）继承自随包档案 cn.template；opcode 由本机在客户端 2026.09.01.0000.0000 的被动流量中按结构与时序重新识别（排本请求 C2S 0xc001 与其回执配对），涉及轮盘编号 1；匹配状态的选择器取值来自本机观察，详见各条证据。用户核对时间线后启用。本档案不含 calibration 段，不能作为下一版本的模板；同版本的随包档案出现时自动让位。",
    "evidence": [
      {
        "field": "messages.CONTENT_FINDER_POP.opcode",
        "method": "OBSERVED_LOCAL_TRAFFIC",
        "recorded_at_utc": "2026-09-09T12:30:00.000Z",
        "sample_count": 2,
        "note": "本机校准：在客户端 2026.09.01.0000.0000 的被动流量里，按模板 cn.template 的 CONTENT_FINDER_POP 结构（长度 40、字段偏移继承自模板）找到唯一满足条件的 opcode，样本 2 次。状态取值（finder_state = 3）来自本机观察，不是继承：只有在同轮盘的已配对请求之后、回执窗口与实际加载之外到达，并在模板匹配窗口内由唯一已知副本进本佐证的取值才被当作匹配成功，并且它从未作为申请回执出现过。判据：同一连接上客户端排本请求后在模板回执窗口内回传同一轮盘编号；候选来自同一 opcode 配对，晚于同轮盘请求，在回执窗口与实际加载之外，并由模板匹配窗口内唯一已知副本进本佐证；状态取值从未出现在回执里，歧义不启用。"
      },
      {
        "field": "messages.ZONE_INITIALIZATION.opcode",
        "method": "OBSERVED_LOCAL_TRAFFIC",
        "recorded_at_utc": "2026-09-09T12:30:00.000Z",
        "sample_count": 3,
        "note": "本机校准：在客户端 2026.09.01.0000.0000 的被动流量里，按模板 cn.template 的 ZONE_INITIALIZATION 结构（长度 456、字段偏移继承自模板）找到唯一满足条件的 opcode，样本 3 次。判据：长度等于模板长度，在至少三个换区簇里各恰好出现一次，且所选同一链的进本、出本簇各恰好一次；簇外出现不超过 2 次，或簇外次数的 3 倍不超过它恰好出现一次的簇数。"
      },
      {
        "field": "messages.CONTENT_FINDER_POP.opcode",
        "method": "USER_CONFIRMED",
        "recorded_at_utc": "2026-09-09T12:30:00.000Z",
        "sample_count": 4,
        "note": "用户在软件里逐条核对了校准时间线（排本、匹配弹窗、进入副本、离开副本）并全部确认无误。"
      },
      {
        "field": "messages.ZONE_INITIALIZATION.opcode",
        "method": "USER_CONFIRMED",
        "recorded_at_utc": "2026-09-09T12:30:00.000Z",
        "sample_count": 4,
        "note": "用户在软件里逐条核对了校准时间线（排本、匹配弹窗、进入副本、离开副本）并全部确认无误。"
      }
    ]
  },
  "profile_sha256": "f39940c61b3d6b78a5aaec7ed716e2a842e18634d8843b93f1f4fc751a88c54c"
}